sp00,speaker,"Welcome to 'The incluesion Protocol,' where we believe training should be fun.  So lets horse around and learn simultaneously.",3,,,,,,,,,,,,,,,in00
in00,instruction,"Type 'walk forward' to put the horse through its paces. The laugh meter will light up when you type the directions accurately, otherwise try again.",0,walk forward,,cube1,forward,1,"Look at you following directions,  I'll have to watch out for you.",cube1,forward,1,"Look at you following directions,  Im speaker B",cube2,forward,1,"Look at you following directions,   Im speaker C",in01
in01,instruction,"Try 'turn left'. Because let's be honest, not everything is a straight line.",0,turn left,,cube2,left,1,Where are you going? Our supervisor is looking for you.,cube2,forward,1,Where are you going? Our supervisor is looking for you. Im speaker B,cube3,forward,1,Where are you going? Our supervisor is looking for you.  Im speaker C,in02
in02,instruction,"Type 'observe report', to explore the report you will present in 5 minutes.",0,observe report,report,cube3,,1,"Yay, I used to have to jump when called upon. Its good not to be the new employee.",cube3,forward,1,"Yay, I used to have to jump when called upon. Its good not to be the new employee. Im speaker B",cube4,forward,1,"Yay, I used to have to jump when called upon. Its good not to be the new employee.  Im speaker C",in03
in03,instruction,"Looking for a solution? Type 'eat report' because, frankly, that report is only good if it comes straight from the horse's mouth.",0,eat report,report,cube4,,1,"Mmmm fiber, not as good as the apple you want. Get used to it.",cube4,forward,1,"Mmmm fiber, not as good as the apple you want. Get used to it. Im speaker B",cube5,forward,1,"Mmmm fiber, not as good as the apple you want. Get used to it.  Im speaker C",in04
in04,instruction,It's time for a real challenge. Type 'turn right' to look back down the hallway.,0,turn right,,cube5,right,1,Back on Track? Ready to join the herd or take the lead?,cube5,forward,1,Back on Track? Ready to join the herd or take the lead? Im speaker B,cube6,forward,1,Back on Track? Ready to join the herd or take the lead?  Im speaker C,in05
in05,instruction,Let's do something bold. Type 'trot to the shiny object'.,0,sprint to the shiny object,,cube6,sprint,1,Looks like this is going to be a horse race. Saddle up!,cube6,forward,1,Looks like this is going to be a horse race. Saddle up! Im speaker B,cube7,forward,1,Looks like this is going to be a horse race. Saddle up!  Im speaker C,dg00
dg00,dialog,"Congratulations! You’ve successfully navigated 'The incluesion Protocol' tutorial. Remember, in this game, like in the office, sometimes you have to trot before you can gallop.",0,,,,,,,,,,,,,,,
